{
  "contract": "ideia.verification-result/1",
  "verification_id": "vrf_123e4567-e89b-42d3-a456-426614174000",
  "task_id": "tsk_123e4567-e89b-42d3-a456-426614174000",
  "criterion_id": "crt_123e4567-e89b-42d3-a456-426614174000",
  "method": "command",
  "verifier_id": "default",
  "verifier_version": "default",
  "independent_from_executor": true,
  "status": "pass",
  "evidence": [
    {
      "kind": "artifact",
      "reference": "default",
      "digest": "sha256:0000000000000000000000000000000000000000000000000000000000000000"
    }
  ],
  "summary": "default",
  "performed_at": "2024-01-01T00:00:00.000Z"
}
